{
  "$schema": "https://json-schema.org/draft/2020-12/schema",
  "title": "FR-Prep-B2 frozen FJ replay authorization",
  "type": "object",
  "additionalProperties": false,
  "required": ["schema_version","checkpoint","implementation_stage","dataset_id","dataset_role","symbol","timeframe","mode","descriptor_identity_sha256","r1b1c_canonical_summary_sha256","r1b2_canonical_summary_sha256","r1b2_contract","r1b2_result","wrapper","legacy_runner","detector","gap_policy","sources","expected_counts","expected_hashes","requested_operations","detector_execution_allowed","outcome_execution_allowed","fq_access_allowed","atr_event_generation_allowed","tp_sl_calculation_allowed","fn_interpretation_allowed","mt5_execution_allowed","ea_execution_allowed","profitability_claim_allowed","runtime_paths_excluded_from_identity","raw_csv_commit_allowed"],
  "properties": {
    "schema_version": {"const": "fr_prep_b2_fj_replay_authorization.v1"},
    "checkpoint": {"const": "FR_PREP_B2"},
    "implementation_stage": {"const": "FR_PREP_B2_FROZEN_FJ_BACKWARD_COMPATIBLE_REPLAY"},
    "dataset_id": {"const": "FJ_2023_2025_GOLD_H1"},
    "dataset_role": {"const": "DEVELOPMENT_BACKWARD_COMPATIBILITY_REPLAY"},
    "symbol": {"const": "GOLD#"},
    "timeframe": {"const": "H1"},
    "mode": {"const": "FJ_BACKWARD_COMPATIBLE_REPLAY_ONLY"},
    "descriptor_identity_sha256": {"const": "dd325e9a81de40c07e5a579226b4d82d3bfdb06b8a14e3f1a562b8e847119848"},
    "r1b1c_canonical_summary_sha256": {"const": "da22164a2cf95c2524ea645a65e07eb3a1188df836d97b963e1cd577657cfd44"},
    "r1b2_canonical_summary_sha256": {"const": "b34fc49c4fc83696abceeccf6d2194253be83811b14b4ed060e33b3eed7936a3"},
    "r1b2_contract": {"$ref": "#/$defs/binding"},
    "r1b2_result": {"$ref": "#/$defs/binding"},
    "wrapper": {"$ref": "#/$defs/binding"},
    "legacy_runner": {"$ref": "#/$defs/binding"},
    "detector": {"$ref": "#/$defs/binding"},
    "gap_policy": {"$ref": "#/$defs/binding"},
    "sources": {"type": "array", "minItems": 3, "maxItems": 3, "items": {"type": "object", "additionalProperties": false, "required": ["file_name","file_sha256","row_count"], "properties": {"file_name":{"type":"string"},"file_sha256":{"$ref":"#/$defs/sha"},"row_count":{"type":"integer","minimum":1}}}},
    "expected_counts": {"type":"object","additionalProperties":false,"required":["source_rows","gap_count","accepted_closures","unverified_gaps","events","long","short"],"properties":{"source_rows":{"const":17716},"gap_count":{"const":773},"accepted_closures":{"const":745},"unverified_gaps":{"const":28},"events":{"const":1079},"long":{"const":588},"short":{"const":491}}},
    "expected_hashes": {"type":"object","additionalProperties":false,"required":["event_population_sha256","exclusion_population_sha256","population_summary_sha256","terminal_status_summary_sha256"],"properties":{"event_population_sha256":{"const":"db59643834e06acbfebb66026634f4f561fb9b07131fdca1513e3585cd51c74b"},"exclusion_population_sha256":{"const":"1a150cfc3ae0f338e0f43710187c9bc6363e32dd453fd85a9e5f4a231e4952ed"},"population_summary_sha256":{"const":"5a45eb6e58b7b38764c6ecbf51fbf6e8472c702b8ebe28c97bee9beafcfba408"},"terminal_status_summary_sha256":{"const":"b9edb4f6455d4742e9e77f1d3b23b920c145cc1b3eee3d53eed9d1b05235b1ef"}}},
    "requested_operations": {"type":"array","minItems":6,"maxItems":6,"uniqueItems":true,"items":{"enum":["COMPARE_LEGACY_EVENT_POPULATION","CONTROLLED_RELOCATION_REPLAY","EXECUTE_FROZEN_FJ_REPLAY","IMPORT_FROZEN_DETECTOR","VALIDATE_FROZEN_R1B1C_EVIDENCE","VALIDATE_FROZEN_R1B2_DESCRIPTOR"]}},
    "detector_execution_allowed": {"const": true},
    "outcome_execution_allowed": {"const": false},
    "fq_access_allowed": {"const": false},
    "atr_event_generation_allowed": {"const": false},
    "tp_sl_calculation_allowed": {"const": false},
    "fn_interpretation_allowed": {"const": false},
    "mt5_execution_allowed": {"const": false},
    "ea_execution_allowed": {"const": false},
    "profitability_claim_allowed": {"const": false},
    "runtime_paths_excluded_from_identity": {"const": true},
    "raw_csv_commit_allowed": {"const": false}
  },
  "$defs": {
    "sha": {"type":"string","pattern":"^[0-9a-f]{64}$"},
    "binding": {"type":"object","additionalProperties":false,"required":["path","file_sha256"],"properties":{"path":{"type":"string","minLength":1},"file_sha256":{"$ref":"#/$defs/sha"}}}
  }
}
